{
  "app_id": "vlc",
  "graph_version": "1.0",
  "session_id": "sess_20260910_172505_680bab",
  "generated_at": "2026-09-10T17:30:17.754194+00:00",
  "nodes": [
    {
      "name": "首次启动欢迎页（系统无响应覆盖）",
      "description": "深色欢迎页可见 VLC 锥形图标、欢迎文案、底部“跳过/下一项”；系统同时弹出“系统界面没有响应”对话框，提供“关闭应用/等待”。",
      "visual_evidence": [
        1
      ],
      "entry_conditions": [
        "首次启动目标 App"
      ],
      "observed_elements": [
        "VLC 图标",
        "欢迎使用 VLC!",
        "自由开源的多媒体播放器",
        "跳过",
        "下一项",
        "系统界面没有响应",
        "关闭应用",
        "等待"
      ],
      "confidence": 1.0,
      "id": "state_首次启动欢迎页_系统无响应覆盖",
      "type": "STATE",
      "status": "confirmed",
      "created_step": 0,
      "updated_step": 0
    },
    {
      "name": "权限说明页",
      "description": "引导说明 VLC 需要访问设备媒体的许可；展示三种权限等级示意，当前高亮“扫描所有文件、播放各类媒体文件（含奇怪格式及压缩文件）”。底部仍有跳过与下一项。",
      "visual_evidence": [
        5
      ],
      "entry_conditions": [
        "欢迎页点击“下一项”"
      ],
      "observed_elements": [
        "权限",
        "VLC 需要您的许可，才能访问设备中的媒体",
        "三档权限示意",
        "所有文件扫描说明",
        "跳过",
        "下一项"
      ],
      "confidence": 1.0,
      "id": "state_权限说明页",
      "type": "STATE",
      "status": "confirmed",
      "created_step": 2,
      "updated_step": 2
    },
    {
      "name": "引导页逐步前进",
      "description": "点击欢迎页“下一项”进入权限说明页，并保留跳过与继续入口。",
      "behavior": {
        "preconditions": [],
        "trigger": null,
        "inputs": [],
        "postconditions": [],
        "persistent_effects": [],
        "constraints": [],
        "error_cases": []
      },
      "evidence": [
        {
          "step": 2,
          "before_frame": 3,
          "action": "tap(920,2210) 欢迎页“下一项”",
          "after_frame": 4,
          "note": null
        }
      ],
      "confidence": 1.0,
      "status": "confirmed",
      "id": "feature_引导页逐步前进",
      "type": "FEATURE",
      "created_step": 2,
      "updated_step": 2
    }
  ],
  "edges": [],
  "unresolved_questions": [],
  "coverage_summary": {
    "states": 2,
    "features": 1,
    "data_entities": 0,
    "edges": 0,
    "confirmed_ratio": 1.0,
    "actions_used": 2
  }
}